{
  "$schema": "./canonical-index.schema.json",
  "schemaVersion": 1,
  "indexType": "review-disposition",
  "controllerOwner": "agent-teams-hosted-web-refactor-controller-v2",
  "phaseId": "phase-00",
  "phaseStartSha": "a32f509e6d9bd31ba2135940e336729bf90c3d93",
  "currentIntegrationCommit": "0bf8f2d105def1fa34dd8dedfb8d345d720dc35e",
  "generatedAt": "2026-07-12T01:47:35Z",
  "reviews": [
    {
      "reviewId": "P0.CURRENT.REVIEW.W1",
      "lanes": ["w1"],
      "disposition": "controller-adopted",
      "scope": "Exact clean-base v9 reproduction of reviewed v8 W1 output; estimate scope escalation remains explicit and does not invalidate the evidence adoption.",
      "sources": [
        {
          "path": ".codex-handoff/phase-00-w1.json",
          "sha256": "0cc95df4fe153e046788d8592dda638cfd2ebf199133f670917db22bab32a10e",
          "scope": "repository"
        }
      ]
    },
    {
      "reviewId": "P0.CURRENT.REVIEW.W2",
      "lanes": ["w2"],
      "disposition": "approve",
      "scope": "Exact 22-path targeted A1 bundle approved with no blocking defects; its phaseStartSha label is separately corrected by controller identity authority.",
      "sources": [
        {
          "path": "/var/data/agent-teams-hosted-web-refactor/worktrees/phase-00-w2-targeted-fix-review-a1-r9/.codex-handoff/phase-00-w2-targeted-fix-review-a1-r9.json",
          "sha256": "ffb2d7173cff698deed1dbc7c93517f4926894a5eb3af9b923d3546fe1374abf",
          "scope": "controller-external"
        },
        {
          "path": "/var/data/agent-teams-hosted-web-refactor/worker-jobs/jobs/agent-teams-hosted-web-refactor-phase-00-w2-targeted-fix-review-a1-r9/agent-teams-hosted-web-refactor-phase-00-w2-targeted-fix-review-a1-r9.latest-result.json",
          "sha256": "ff9d800de6a827aa479f988c8b70b546f9a93ffe0dbf1dea9405130564adbf30",
          "scope": "controller-external"
        }
      ]
    },
    {
      "reviewId": "P0.CURRENT.REVIEW.W3_W5",
      "lanes": ["w3", "w5"],
      "disposition": "compatible-narrowed",
      "scope": "Adopted W3/W5 pair is reciprocally compatible within the Phase 0 r3 evidence-only boundary; no later implementation readiness is implied.",
      "sources": [
        {
          "path": "docs/research/hosted-web/phase-0/reciprocal-reviews/w3-w5-current-canonical.md",
          "sha256": "7bc2ded46924f18e28b0b85d3dafbd09e17662cf7e95c11b139bfe799a4f1564",
          "scope": "repository"
        }
      ]
    },
    {
      "reviewId": "P0.CURRENT.REVIEW.W4_W6",
      "lanes": ["w4", "w6"],
      "disposition": "approve",
      "scope": "Exact 36-file paired bundle approved; evidence remains characterization and explicitly does not admit a final hosted artifact or terminal.",
      "sources": [
        {
          "path": "/var/data/agent-teams-hosted-web-refactor/worktrees/phase-00-review-w4-w6-v6/.codex-handoff/phase-00-review-w4-w6-v6.json",
          "sha256": "5c4c0ed2792df575dfd74c3a197ff00af6ed2abcc001dd815c39e70a87f7ed7a",
          "scope": "controller-external"
        },
        {
          "path": "/var/data/agent-teams-hosted-web-refactor/worker-jobs/jobs/agent-teams-hosted-web-refactor-phase-00-review-w4-w6-v6/agent-teams-hosted-web-refactor-phase-00-review-w4-w6-v6.latest-result.json",
          "sha256": "b29b4188a98de25cead5f299e9fab0e16160d8f3f0252023050d8fc73cbe52cc",
          "scope": "controller-external"
        }
      ]
    }
  ]
}
